{
  "accountId": "11111111-1111-4111-8111-111111111111",
  "snapshotId": "33333333-3333-4333-8333-333333333333",
  "formatVersion": 1,
  "coveredThroughCursor": "c10b:2",
  "compatibleEventTypes": [
    {
      "eventType": "purchase.registered",
      "payloadVersion": 3
    }
  ],
  "compatibleSchemaVersion": 6,
  "chunks": [
    {
      "index": 0,
      "length": 2,
      "hash": "44136fa355b3678a1146ad16f7e8649e94fb4fc21fe77e8310c060f61caaff8a"
    }
  ],
  "totalBytes": 2,
  "totalHash": "44136fa355b3678a1146ad16f7e8649e94fb4fc21fe77e8310c060f61caaff8a",
  "factCounts": {
    "accounts": 1,
    "stores": 1,
    "products": 1,
    "people": 0,
    "paymentMethods": 0,
    "purchases": 1,
    "purchaseItems": 1
  }
}
